{
  "format": "palo-agentic-interface",
  "schemaVersion": "1.1.0",
  "profileVersion": "1.0.0",
  "agentId": "agent-support-copilot-sub-1",
  "status": "active",
  "identity": {
    "role": "Customer Support subagent",
    "lineage": "com.fabriziodegni.paloframework.agents.support-copilot.sub-1",
    "baseModel": "gemini-2.5-flash",
    "systemPromptHash": "sha256:a1b2c3d4e5f6a1b2c3d4e5f6a1b2c3d4e5f6a1b2c3d4e5f6a1b2c3d4e5f61234",
    "temperature": 0.2
  },
  "authority": {
    "allowedTools": ["read_file", "search_web"],
    "allowedOperations": ["read", "execute"],
    "externalNetwork": false,
    "allowedNetworkHosts": [],
    "readScopes": ["/workspace/support-docs"],
    "writeScopes": [],
    "requireVibeGate": false,
    "argumentSchemas": {
      "read_file": {
        "type": "object",
        "required": ["path"],
        "properties": { "path": { "type": "string" } },
        "additionalProperties": false
      },
      "search_web": {
        "type": "object",
        "required": ["query"],
        "properties": { "query": { "type": "string", "minLength": 1 } },
        "additionalProperties": false
      }
    }
  },
  "delegation": {
    "maxDepth": 0,
    "maxSubagents": 0,
    "allowedSubagentRoles": [],
    "requireHumanValidation": true
  },
  "evidence": {
    "keyId": "key-support-2026",
    "algorithm": "HMAC-SHA256",
    "auditTrailId": "ledger-support-2026",
    "redactFields": ["customerEmail", "accessToken"]
  }
}
